{
  "brand": {
    "name": "Clomni, Inc.",
    "primary_color": "#10A670"
  },
  "launcher": {
    "visible": false
  },
  "home": {
    "cards": [
      "new_conversation"
    ]
  },
  "team": {},
  "bot": {
    "name": "Clomni"
  },
  "composer": {},
  "languages": [
    "az"
  ],
  "strings": {},
  "limits": {}
}
