{
  "brand": {
    "name": "Apar",
    "logo_url": "https://app.clomni.ai/a/apar.png",
    "primary_color": "#1F9D63",
    "on_primary_color": "#FFFFFF",
    "theme": "system"
  },
  "launcher": {
    "visible": false,
    "position": "right",
    "bottom_padding": 20,
    "icon": "default"
  },
  "home": {
    "greeting_title": "Necə kömək edə bilərik?",
    "greeting_subtitle": "Bizdən nəsə soruşun və ya fikrinizi bildirin",
    "show_team_avatars": true,
    "channels": [
      {
        "type": "instagram",
        "url": "https://instagram.com/apar.az"
      },
      {
        "type": "whatsapp",
        "url": "https://wa.me/994501234567"
      },
      {
        "type": "linkedin",
        "url": "https://linkedin.com/company/apar"
      },
      {
        "type": "email",
        "url": "mailto:support@apar.az"
      }
    ],
    "cards": [
      "recent_conversation",
      "new_conversation"
    ]
  },
  "team": {
    "avatars": [
      "https://app.clomni.ai/a/leyla.png",
      "https://app.clomni.ai/a/rauf.png",
      "https://app.clomni.ai/a/nigar.png"
    ],
    "reply_time": "Adətən bir neçə dəqiqəyə cavab veririk",
    "office_hours": {
      "tz": "Asia/Baku",
      "open_now": true
    }
  },
  "bot": {
    "name": "Clomni",
    "avatar_url": "https://app.clomni.ai/a/bot.png"
  },
  "composer": {
    "placeholder": "Mesaj yazın…",
    "attachments": true,
    "emoji": true
  },
  "languages": [
    "az",
    "en",
    "ru"
  ],
  "strings": {
    "today": "Bu gün",
    "yesterday": "Dünən",
    "send": "Göndər",
    "new_conversation": "Bizə mesaj göndərin",
    "sent": "Göndərildi",
    "read": "Oxundu",
    "choose_above": "Yuxarıdakı variantlardan birini seçin"
  },
  "limits": {
    "image_mb": 10,
    "file_mb": 25,
    "text_chars": 4000
  }
}
